title,subtitle,authors,categories,published_year,average_rating,num_pages,ratings_count
Sexing the Cherry,,Jeanette Winterson,Fiction,1989.0,3.83,167.0,11567.0
This boy's life,,Tobias Wolff,Biography & Autobiography,1999.0,3.98,304.0,22157.0
The Six Wives of Henry VIII,,Alison Weir,Biography & Autobiography,2000.0,4.11,643.0,53977.0
Last Words,The Final Journals of William S. Burroughs,William S. Burroughs,Biography & Autobiography,2001.0,3.98,273.0,479.0
Four Blondes,,Candace Bushnell,Fiction,2001.0,2.82,256.0,23143.0
The House of Morgan,An American Banking Dynasty and the Rise of Modern Finance,Ron Chernow,Biography & Autobiography,2001.0,4.07,812.0,4669.0
The Eternal Frontier,An Ecological History of North America and Its Peoples,Tim Flannery,History,2002.0,4.05,432.0,554.0
Parliament of Whores,A Lone Humorist Attempts to Explain the Entire U.S. Government,P. J. O'Rourke,Humor,2003.0,4.01,240.0,2714.0
Charlie Wilson's War,,George Crile,History,2003.0,4.0,560.0,5803.0
Monster,The Autobiography of an L.A. Gang Member,Sanyika Shakur,Biography & Autobiography,1993.0,3.96,400.0,4064.0
Layer Cake,Life and Thought in Mexico,J. J. Connolly,Fiction,2004.0,3.99,344.0,965.0
Reservation Blues,,Sherman Alexie,Fiction,2005.0,3.98,306.0,10879.0
Lord Malquist and Mr. Moon,,Tom Stoppard,Fiction,2006.0,3.4,200.0,185.0
Cold Mountain,A Novel,Charles Frazier;George Vithoulkas,Fiction,2006.0,3.85,356.0,201921.0
The Labyrinth of Solitude,And the Other Mexico ; Return to the Labyrinth of Solitude ; Mexico and the United States ; The Philanthropic Ogre,Octavio Paz,History,1985.0,4.15,398.0,5013.0
Every Good Boy Deserves Favor and Professional Foul,,Tom Stoppard,Drama,1978.0,3.9,188.0,186.0
"Exit the King, The Killer, and Macbett",Three Plays,Eugène Ionesco,Drama,1985.0,4.11,105.0,174.0
"Destroy, She Said",,Marguerite Duras,Fiction,1986.0,3.68,133.0,532.0
Sexus,The Rosy Crucifixion I,Henry Miller,Fiction,1987.0,4.04,506.0,7024.0
Tropic of Capricorn,,Henry Miller,Fiction,1961.0,3.82,348.0,13549.0
The 10 Commandments of Parenting,The Do's and Don'ts for Raising Great Kids,H. Edwin Young,Religion,2005.0,4.0,224.0,25.0
Little Pilgrim's Progress,From John Bunyan's Classic,Helen L. Taylor,Juvenile Fiction,2006.0,4.25,336.0,1945.0
E=mc2,A Biography of the World's Most Famous Equation,David Bodanis,Science,2000.0,4.09,352.0,157.0
Longitude,The True Story of a Lone Genius Who Solved the Greatest Scientific Problem of His Time,Dava Sobel;Neil Armstrong,Science,2005.0,3.96,192.0,43661.0
The -Alchemist's Kitchen,Extraordinary Potions & Curious Notions,Guy Ogilvy,"Body, Mind & Spirit",2006.0,4.02,58.0,131.0
A History of the World in 6 Glasses,,Tom Standage,Cooking,2006.0,3.76,336.0,13105.0
The Illustrated Longitude,The True Story of a Lone Genius Who Solved the Greatest Scientific Problem of His Time,Dava Sobel;William J.H. Andrewes,Science,2003.0,4.09,224.0,166.0
Once Upon a Cool Motorcycle Dude,,Kevin O'Malley,Juvenile Fiction,2005.0,4.08,32.0,1730.0
The Pilgrim's Regress,,C. S. Lewis,Religion,1981.0,3.86,219.0,5870.0
A Time to Embrace,"Same-Gender Relationships in Religion, Law, and Politics",William Stacy Johnson,Political Science,2006.0,4.2,330.0,44.0
Jesus and the Eyewitnesses,The Gospels as Eyewitness Testimony,Richard Bauckham,Religion,2006.0,4.3,538.0,632.0
The Early History of God,Yahweh and the Other Deities in Ancient Israel,Mark S. Smith,Religion,2002.0,4.06,243.0,217.0
Pirates of Venus,,Edgar Rice Burroughs,Fiction,1934.0,3.69,179.0,1203.0
The Coming of the Fairies,,Arthur Conan Doyle,Fiction,2006.0,3.39,189.0,197.0
The Lost Continent,The Story of Atlantis,C. J. Cutcliffe Hyne,Fiction,2002.0,3.78,260.0,19.0
Black Elk Speaks,Being the Life Story of a Holy Man of the Oglala Sioux,Black Elk;John Gneisenau Neihardt;Alexis N. Petri;Lori Utecht,Biography & Autobiography,2004.0,4.14,270.0,9916.0
A Lie and a Libel,The History of the Protocols of the Elders of Zion,Binjamin W. Segel,History,1996.0,3.56,148.0,7.0
William Shakespeare's Twelfth Night,,Bruce Coville;Tim Raglin,Juvenile Fiction,2003.0,4.11,48.0,138.0
William Shakespeare's Romeo and Juliet,,Anonymous,Juvenile Fiction,1999.0,3.97,40.0,175.0
Time for Ballet,,Adèle Geras;Shelagh McNicholas,Juvenile Fiction,2004.0,3.71,32.0,68.0
House of Incest,,Anaïs Nin,Fiction,1989.0,3.8,72.0,1774.0
A Woman Speaks,"The Lectures, Seminars, and Interviews of Anais Nin",Anaïs Nin;Evelyn J. Hinz,Literary Collections,1975.0,4.16,288.0,184.0
The 13th directorate,,Barry Chubin,Fiction,1989.0,2.62,0.0,8.0
The Killer Department,Detective Viktor Burakov's Eight-year Hunt for the Most Savage Serial Killer in Russian History,Robert Cullen,"Insane, Criminal and dangerous",1993.0,4.03,258.0,92.0
Patty Jane's House of Curl,,Lorna Landvik,Fiction,1999.0,3.86,304.0,8741.0
Tending Lives,Nurses on the Medical Front,Echo Heron,Medical,1998.0,4.27,416.0,381.0
A Patchwork Planet,,Anne Tyler,Fiction,2001.0,3.79,320.0,11090.0
Horse Heaven,,Jane Smiley,Fiction,2003.0,3.88,640.0,4504.0
The Epic of Gilgamesh,,Maureen Gallery Kovacs,Literary Criticism,1989.0,3.67,122.0,302.0
The Consequences of Modernity,,Anthony Giddens,Social Science,1990.0,3.79,188.0,559.0
Taking God Out of Mathematics and Putting the Body Back in,An Essay in Corporeal Semiotics,Brian Rotman,Philosophy,1993.0,4.06,224.0,17.0
"Human, All Too Human, I",,Friedrich Wilhelm Nietzsche;Gary Handwerk,Philosophy,2000.0,4.22,396.0,62.0
The Golden Country,A Play About Christian Martyrs in Japan,Shusaku Endo;Shūsaku Endō,Drama,2003.0,3.74,128.0,44.0
The Anatomy of Human Destructiveness,,Erich Fromm,Psychology,1992.0,4.2,576.0,2104.0
Escape from Freedom,,Erich Fromm,Political Science,1994.0,4.24,301.0,6825.0
Clown,,Quentin Blake,Juvenile Fiction,1998.0,3.97,32.0,369.0
Crime and Punishment in America,,Elliott Currie,Social Science,1998.0,3.82,240.0,65.0
The Magic Journey,A Novel,John Nichols,Fiction,2000.0,3.91,528.0,433.0
Robert Frost,A Life,Jay Parini,Biography & Autobiography,2000.0,4.13,514.0,249.0
The Milagro Beanfield War,A Novel,John Nichols,Fiction,2000.0,4.09,456.0,8841.0
Nickel and Dimed,On (Not) Getting By in America,Barbara Ehrenreich,Business & Economics,2002.0,3.62,240.0,163279.0
Eight Men Out,The Black Sox and the 1919 World Series,Eliot Asinof,Sports & Recreation,2000.0,4.02,336.0,8287.0
John Adams,"The American Presidents Series: The 2nd President, 1797-1801",John P. Diggins,Biography & Autobiography,2003.0,3.88,224.0,341.0
Ulysses S. Grant,"The American Presidents Series: The 18th President, 1869-1877",Josiah Bunting,Biography & Autobiography,2004.0,3.85,208.0,391.0
You Come Too,Favorite Poems for Readers of All Ages,Robert Frost,Juvenile Nonfiction,2002.0,4.16,92.0,77.0
The Poetry of Robert Frost,"The Collected Poems, Complete and Unabridged",Robert Frost,Poetry,2002.0,4.31,607.0,1361.0
Rosa,,Nikki Giovanni,Juvenile Nonfiction,2005.0,4.35,40.0,5942.0
Media Unlimited,How the Torrent of Images and Sounds Overwhelms Our Lives,Todd Gitlin,Social Science,2003.0,3.55,256.0,112.0
In Harm's Way,The Sinking of the U.S.S. Indianapolis and the Extraordinary Story of Its Survivors,Doug Stanton,History,2003.0,4.28,384.0,15946.0
Shakespeare's Secret,,Elise Broach,Juvenile Fiction,2005.0,3.87,256.0,7234.0
The Second World War,A Complete History,Martin Gilbert,History,2004.0,4.19,928.0,853.0
The Nubian Prince,A Novel,Juan Bonilla,Fiction,2006.0,3.56,258.0,61.0
"The Historical Atlas of New York City, Second Edition",A Visual Celebration of 400 Years of New York City's History,Eric Homberger,History,2005.0,4.05,192.0,290.0
Messenger of Truth,A Maisie Dobbs Novel,Jacqueline Winspear,Fiction,2006.0,3.99,322.0,15111.0
Saint-Exupery,A Biography,Stacy Schiff,Biography & Autobiography,2006.0,4.05,560.0,195.0
The Black Cauldron,,Lloyd Alexander,Juvenile Fiction,2006.0,4.14,182.0,51994.0
Taran Wanderer,,Lloyd Alexander,Juvenile Fiction,2006.0,4.14,222.0,33286.0
The High King,,Lloyd Alexander,Juvenile Fiction,2006.0,4.24,253.0,47268.0
The Foundling,And Other Tales of Prydain,Lloyd Alexander,Juvenile Fiction,2006.0,3.93,98.0,3563.0
Travels in the Scriptorium,A Novel,Paul Auster,Fiction,2007.0,3.23,145.0,6492.0
The diaries of Franz Kafka,,Franz Kafka;Max Brod,Biography & Autobiography,1965.0,4.23,345.0,8.0
The diaries,1910-1923,Franz Kafka,Biography & Autobiography,1988.0,4.23,521.0,2028.0
"The Trial of God (as it was Held on February 25, 1649, in Shamgorod)",A Play,Elie Wiesel,Fiction,1995.0,4.13,208.0,915.0
The Complete Stories,,Franz Kafka,Fiction,1995.0,4.35,486.0,19625.0
"The Magic Orange Tree, and Other Haitian Folktales",,Diane Wolkstein;Elsa Henriquez,Fiction,1978.0,4.16,224.0,120.0
How to Be a Jewish Parent,A Practical Handbook for Family Life,Anita Diamant;Karen Kushner,Family & Relationships,2000.0,3.95,352.0,50.0
The Zürau Aphorisms of Franz Kafka,,Franz Kafka,Philosophy,2006.0,3.76,160.0,615.0
Emma Lazarus,,Esther H. Schor,Biography & Autobiography,2006.0,3.9,368.0,27.0
The Origins of Totalitarianism,,Hannah Arendt,Philosophy,1951.0,4.27,674.0,74.0
The Anatomy Coloring Book,,Wynn Kapit;Lawrence M. Elson,Science,2002.0,4.25,400.0,1620.0
Human Anatomy & Physiology,,Elaine Nicpon Marieb;Katja Hoehn,Medical,2007.0,4.0,1296.0,410.0
Anatomy & Physiology Coloring Workbook,A Complete Study Guide,Elaine N. Marieb,Medical,2004.0,3.94,368.0,6.0
The Feynman Lectures on Physics,,Richard Phillips Feynman;Robert B. Leighton;Matthew Linzee Sands,Science,2006.0,4.6,1552.0,6120.0
The Feynman Lectures on Physics,,Richard Phillips Feynman;Robert B. Leighton;Matthew Linzee Sands,Science,1963.0,4.61,512.0,17.0
The Feynman Lectures on Physics,,Richard Phillips Feynman;Robert B. Leighton;Matthew Linzee Sands,Science,1963.0,4.62,384.0,686.0
Watchmen on the Walls,An Eyewitness Account of Israel's Fight for Independence from the Journal of Hannah Hurnard,Hannah Hurnard,History,1998.0,4.0,184.0,38.0
Letters to Children,,Clive Staples Lewis,Religion,1985.0,4.18,128.0,1581.0
Things Pondered,From the Heart of a Lesser Woman,Beth Moore,Religion,2004.0,4.09,160.0,282.0
Once Upon a Gulf Coast Summer,,Susan Oliver,Fiction,2004.0,3.45,368.0,35.0
Monkey Business,The True Story of the Scopes Trial,Marvin N. Olasky;John Perry,Religion,2005.0,3.16,368.0,25.0
Writing the Qualitative Dissertation,Understanding by Doing,Judith M. Meloy,Education,2002.0,3.71,242.0,8.0
Ovid's Metamorphoses,Books 6-10,Ovid,Social Science,1972.0,4.3,560.0,31.0
Tibullus,,Michael C. J. Putnam,Foreign Language Study,1979.0,3.67,222.0,6.0
Warfare in the Classical World,"An Illustrated Encyclopedia of Weapons, Warriors, and Warfare in the Ancient Civilisations of Greece and Rome",John Gibson Warry,History,1995.0,4.13,224.0,371.0
Ovid's Metamorphoses,,Ovid,Drama,1997.0,4.25,584.0,220.0
Regeneration Through Violence,"The Mythology of the American Frontier, 1600-1860",Richard Slotkin,Literary Criticism,2000.0,4.28,670.0,157.0
So Far from God,"The U.S. War with Mexico, 1846-1848",John S. D. Eisenhower,History,2000.0,3.93,464.0,253.0
Selections from Homer's Iliad,"With an Introduction, Notes, a Short Homeric Grammar, and a Vocabulary",Homer,Literary Criticism,2001.0,4.39,522.0,64.0
The Broken Wings,,Kahlil Gibran,,1989.0,3.92,132.0,6175.0
Existentialism and Human Emotions,,Jean-Paul Sartre,Philosophy,1985.0,3.84,96.0,4090.0
Wizard,The Life and Times of Nikola Tesla : Biography of a Genius,Marc J. Seifer,Biography & Autobiography,1998.0,3.77,542.0,2613.0
The Parrot Head Companion,An Insider's Guide to Jimmy Buffett,Thomas Ryan,Music,1998.0,2.83,176.0,6.0
The Minority Report,,Philip K. Dick,Fiction,1999.0,4.19,396.0,20.0
Ruby Ann's Down Home Trailer Park Cookbook,,Ruby Ann Boxcar,Cooking,2002.0,4.09,240.0,47.0
Vicars of Christ,A History of the Popes,Charles A. Coulombe,Religion,2003.0,3.97,492.0,30.0
The Minority Report,And Other Classic Stories,Philip K. Dick,Fiction,2002.0,4.19,380.0,448.0
The Complete Films of Alfred Hitchcock,,Robert A. Harris;Michael S. Lasky,Performing Arts,2002.0,4.16,256.0,17.0
Edward Lear,,Edward Lear,Juvenile Nonfiction,2001.0,3.9,48.0,64.0
Man's Search for Meaning,An Introduction to Logotherapy,Viktor Emil Frankl,Psychology,1992.0,4.36,165.0,367.0
Man's Search for Meaning,,Viktor Emil Frankl,Biography & Autobiography,2006.0,4.36,165.0,2624.0
Lorca & Jiménez,,Federico Garcia Lorca,Literary Criticism,1997.0,4.35,208.0,112.0
The Poetics of Space,,Gaston Bachelard,Philosophy,1994.0,4.19,282.0,6625.0
Art and Culture,Critical Essays,Clement Greenberg,Art,1961.0,3.92,288.0,442.0
You Can't be Neutral on a Moving Train,A Personal History of Our Times,Howard Zinn,Biography & Autobiography,2002.0,4.3,214.0,2430.0
When the Rivers Run Dry,"Water, the Defining Crisis of the Twenty-first Century",Fred Pearce,Nature,2006.0,3.95,336.0,642.0
The Collected Poems of Robert Penn Warren,,Robert Penn Warren;John Burt,Poetry,1998.0,4.37,838.0,170.0
The Midnight Mystery (The Boxcar Children Mysteries #95),,Gertrude Chandler Warner,Juvenile Fiction,2003.0,3.94,128.0,296.0
When I Feel Angry,,Cornelia Maude Spelman,Juvenile Fiction,2000.0,3.99,24.0,108.0
A Persian requiem,a novel,Sīmīn Dānishvar,Fiction,1992.0,3.89,279.0,48.0
Einstein's 1912 manuscript on the special theory of relativity,,Albert Einstein,Biography & Autobiography,2003.0,4.41,174.0,17.0
Jasmine and Stars,Reading More Than Lolita in Tehran,Fatemeh Keshavarz,Literary Criticism,2007.0,3.63,174.0,252.0
Allusions in Ulysses,An Annotated List,Weldon Thornton,Literary Criticism,1982.0,4.04,563.0,22.0
The Scotch-Irish,A Social History,James G. Leyburn,History,1989.0,3.97,377.0,198.0
"The Creation of the American Republic, 1776-1787",,Gordon S. Wood,Political science,1998.0,4.12,675.0,1722.0
The Transcendence of the Ego,An Existentialist Theory of Consciousness,Jean-Paul Sartre,Philosophy,1957.0,3.82,120.0,594.0
The Weimar Republic,,Detlev J. K. Peukert,History,1993.0,3.82,360.0,190.0
Love You Until...,,Lisa McCourt,Religion,1999.0,4.67,32.0,3.0
Wooden: A Lifetime of Observations and Reflections On and Off the Court,,John Wooden,Biography & Autobiography,1997.0,4.45,201.0,3216.0
"What Life Was Like on the Banks of the Nile: Egypt, 3050-30 B.C.",,Time-Life,Egypt,1996.0,4.01,192.0,190.0
Manna from Heaven,,Roger Zelazny;Steven Brust;Scott Zrubeck,Fiction,2003.0,3.95,255.0,334.0
Toast,,Charles Stross,Comics & Graphic Novels,2005.0,3.8,247.0,922.0
Anna Karenina,,Leo Nikolayevich Tolstoy;Leo Tolstoy;Constance Garnett,Fiction,2004.0,4.04,740.0,28.0
"Billy Budd, Sailor and Other Uncompleted Writings","Billy Budd, Sailor, Weeds and Wildings, Parthenope, Uncollected Prose, Uncollected Poetry",Herman Melville,Fiction,2017.0,3.11,1016.0,9.0
The Chain of Chance,,Stanisław Lem,Literary Criticism,2000.0,3.71,179.0,487.0
His Master's Voice,,Stanisław Lem,Fiction,1999.0,4.11,199.0,2191.0
A Perfect Vacuum,,Stanisław Lem,Fiction,1999.0,4.17,229.0,739.0
The Phenomenon of Life,Toward a Philosophical Biology,Hans Jonas;Eleonore Jonas,Philosophy,2001.0,4.23,304.0,89.0
Lewis Carroll's Jabberwocky,A Book of Brillig Dioramas,Graeme Base,Juvenile Nonfiction,1996.0,4.14,14.0,31.0
The Lighthouse Land,,Adrian McKinty,Juvenile Fiction,2006.0,3.6,372.0,839.0
Babar's World Tour,,Laurent de Brunhoff,Juvenile Fiction,2005.0,3.84,48.0,65.0
Ruby Gloom's Guide to Friendship,,Mighty Fine Inc.,Juvenile Nonfiction,2005.0,4.34,72.0,37.0
The Beatles,365 Days,Simon Wells,Performing Arts,2005.0,4.16,744.0,97.0
Creating the Worlds of Star Wars,365 Days,John Knoll;J. W. Rinzler,Performing Arts,2005.0,4.13,744.0,86.0
The Art of Maurice Sendak,,Selma G. Lanes,Biography & Autobiography,1998.0,4.44,258.0,773.0
National Geographic Society,100 Years of Adventure and Discovery,C. D.B. Bryan,Photography,2001.0,4.12,528.0,10.0
The Boy Who Couldn't Die,,William Sleator,Juvenile Fiction,2005.0,3.68,161.0,1649.0
Pink Box,Inside Japan's Sex Clubs,Joan Sinclair,Art,2006.0,4.12,192.0,256.0
"Paris Spleen, 1869",,Charles Baudelaire;Charles Pierre Baudelaire,Poetry,1970.0,4.3,118.0,7549.0
The Berlin Stories,,Christopher Isherwood,Fiction,1963.0,4.03,401.0,8749.0
The Air-conditioned Nightmare,,Henry Miller,Fiction,1970.0,3.83,292.0,2627.0
"Mémoires, Plaidoiries Et Documents",,Henry Miller,Biography & Autobiography,1969.0,3.81,327.0,687.0
Henry Miller on Writing,,Henry Miller,Literary Criticism,1964.0,4.23,217.0,937.0
The Collected Poems of Wilfred Owen,,Wilfred Owen,Poetry,1965.0,4.33,192.0,2996.0
Safe Conduct,"An Autobiography, and Other Writings",Boris Leonidovich Pasternak,Biography & Autobiography,1958.0,3.79,256.0,80.0
The Flight of Icarus,,Raymond Queneau,Fiction,1973.0,4.01,191.0,319.0
Turtle Island,,Gary Snyder,Poetry,1974.0,4.09,112.0,3717.0
Selected Poems,,Octavio Paz;G. Aroul,Poetry,1984.0,4.21,160.0,359.0
Seven Nights,,Jorge Luis Borges,Literary Collections,1984.0,4.33,121.0,988.0
The Blue Flowers,,Raymond Queneau,Poetry,1985.0,4.04,232.0,974.0
"The Collected Poems of Octavio Paz, 1957-1987",,Octavio Paz,Poetry,1991.0,4.3,669.0,2863.0
The Crack-up,,Francis Scott Fitzgerald,Literary Collections,1993.0,3.92,347.0,2410.0
Deep River,,Shūsaku Endō,Fiction,1996.0,3.92,216.0,1478.0
The Samurai,A Novel,Shūsaku Endō,Fiction,1997.0,3.95,272.0,1580.0
"The Daring Young Man on the Flying Trapeze, and Other Stories",,William Saroyan,Fiction,1997.0,4.21,272.0,654.0
In Search of Duende,,Federico García Lorca;Norman Thomas Di Giovanni,Poetry,1998.0,4.3,99.0,599.0
Everything and Nothing,,Jorge Luis Borges,Literary Collections,1999.0,4.37,108.0,554.0
The Red Notebook,True Stories,Paul Auster,Fiction,2002.0,3.77,104.0,2306.0
Borges and the Eternal Orangutans,,Luís Fernando Veríssimo;Margaret Jull Costa,Fiction,2005.0,3.79,135.0,538.0
The Selected Poems of Federico García Lorca,,Federico García Lorca,Poetry,2005.0,4.31,186.0,6163.0
October Light,,John Gardner,Fiction,2005.0,3.88,399.0,823.0
Laughter in the Dark,,Vladimir Nabokov;Vladimir Vladimirovich Nabokov;John Banville,Fiction,1960.0,3.96,292.0,8233.0
Wookiee Cookies,A Star Wars Cookbook,Robin Davis,Cooking,1998.0,3.92,132.0,916.0
The Campfire Collection,Spine-tingling Tales to Tell in the Dark,Eric Martin,Fiction,2000.0,3.25,176.0,48.0
The Star Wars Cookbook II,Darth Malt and More Galactic Recipes,Frankie Frankeny;Wesley Martin,Cooking,2000.0,3.85,60.0,198.0
Stylepedia,"A Guide to Graphic Design Mannerisms, Quirks, and Conceits",Steven Heller;Louise Fili,Art,2006.0,4.07,336.0,167.0
Chicago Stories,Tales of the City,John Miller;Genevieve Morgan,Fiction,2003.0,3.56,224.0,44.0
The Star Wars Poster Book,,Stephen Sansweet;Peter Vilmur,Performing Arts,2005.0,4.48,320.0,60.0
Vincent's Colors,,"Metropolitan Museum of Art (New York, N.Y.)",Juvenile Nonfiction,2005.0,4.16,48.0,305.0
I Am 8-bit,Art Inspired by Classic Videogames of the '80s,Jon M. Gibson,Art,2006.0,4.09,156.0,117.0
Edie,Girl on Fire,Melissa Painter;David Weisman,Biography & Autobiography,2006.0,4.22,192.0,716.0
Chaucer's Canterbury Tales (Selected),An Interlinear Translation,Geoffrey Chaucer;Vincent F. Hopper,Literary Collections,1977.0,3.75,530.0,69.0
"Twelfth Night, Or, What You Will",Modern English Version Side-by-side with Full Original Text,William Shakespeare,Drama,1985.0,3.98,256.0,147.0
Forms of Talk,,Erving Goffman,Language Arts & Disciplines,1981.0,3.81,344.0,77.0
"Aeschylus, 1","The Oresteia (Agamemnon, The Libation Bearers, The Eumenides)",Aeschylus,Drama,1998.0,4.01,178.0,12.0
"Euripides, 3","Alcestis, Daughters of Troy, The Phoenician Women, Iphigenia at Aulis, Rhesus",Euripides,Drama,1998.0,3.88,392.0,7.0
"Aeschylus, 2","The Persians, Seven Against Thebes, The Suppliants, Prometheus Bound",Aeschylus,Drama,1998.0,4.1,232.0,12.0
The Negro,,W. E. B. Du Bois,History,2001.0,4.31,284.0,29.0
Aristophanes: The Acharnians,,Smith Palmer Bovie;David R. Slavitt,Greek drama (Comedy),1901.0,3.83,322.0,4.0
Lord of the Flies,,William Golding,Fiction,1959.0,3.67,208.0,310.0
The Last Castle,,Jack Vance;Robert Silverberg,Fiction,1989.0,3.71,182.0,42.0
The Invisible Man,,H. G. Wells,Fiction,1992.0,3.63,178.0,293.0
The Last Book of Swords: Shieldbreaker's Story,,Fred Saberhagen,Fiction,1995.0,3.88,255.0,1204.0
Pastwatch,The Redemption of Christopher Columbus,Orson Scott Card,Fiction,1997.0,3.97,402.0,12695.0
The Medusa in the Shield,,David G. Hartwell,Fiction,1991.0,3.98,498.0,48.0
A Fabulous Formless Darkness,,David G. Hartwell,Fiction,1992.0,4.21,608.0,33.0
The Sixth Book of Lost Swords,Mindsword's Story,Fred Saberhagen,Fiction,1991.0,3.81,250.0,1221.0
The Shadow Rising,Book Four of 'The Wheel of Time',Robert Jordan,Fiction,1993.0,4.23,1007.0,137790.0
Lord of Chaos,Book Six of 'The Wheel of Time',Robert Jordan,Fiction,1995.0,4.12,1011.0,102983.0
Hart's Hope,,Orson Scott Card,Fiction,1988.0,3.47,261.0,32.0
An Armory of Swords,,Fred Saberhagen,Fiction,1996.0,3.79,317.0,174.0
Red Prophet,The Tales of Alvin Maker,Orson Scott Card,Fiction,1988.0,3.79,311.0,17817.0
Anthonology,,Piers Anthony,Fiction,1986.0,3.64,384.0,699.0
Orion,A Novel,Ben Bova,Fiction,1992.0,3.71,432.0,1357.0
The Call of Earth,,Orson Scott Card,Fiction,1994.0,3.58,352.0,10051.0
The Ships of Earth,Homecoming:,Orson Scott Card,Fiction,1995.0,3.54,351.0,9143.0
A Meeting with Medusa,,Kim Stanley Robinson;Arthur Charles Clarke,Fiction,1988.0,3.66,180.0,119.0
Demons Don't Dream,,Piers Anthony,Fiction,1994.0,3.8,352.0,7594.0
Roc and a Hard Place,A Xanth Novel,Piers Anthony,Fiction,1996.0,3.75,344.0,5737.0
Seminole Song,,Vella Munn,Fiction,1998.0,3.72,320.0,43.0
A Crown of Swords,Book Seven of 'The Wheel of Time',Robert Jordan,Fiction,1997.0,4.03,880.0,100910.0
Drum Calls,,Jo Clayton,Fiction,1998.0,3.68,341.0,28.0
Blood of the Fold,,Terry Goodkind,Fiction,1997.0,3.99,623.0,65522.0
The Fourth Book of Lost Swords,Farslayer's Story,Fred Saberhagen,Fiction,1990.0,3.83,252.0,1736.0
Yon Ill Wind,A Xanth Novel,Piers Anthony,Fiction,1997.0,3.75,340.0,3743.0
A Quantum Murder,,Peter F. Hamilton,Fiction,1998.0,3.97,375.0,3868.0
Shadow of the Hegemon,,Orson Scott Card,Fiction,2001.0,3.94,451.0,63691.0
The Dastard,,Piers Anthony,Fiction,2001.0,3.81,384.0,2960.0
Swell Foop,,Piers Anthony,Fiction,2002.0,3.78,384.0,2822.0
Vale of the Vole,,Piers Anthony,Fiction,2000.0,3.6,304.0,9074.0
Up In a Heaval,,Piers Anthony,Fiction,2003.0,3.82,342.0,2318.0
Legends,Short Novels by the Masters of Modern Fantasy,George R. R. Martin;Anne McCaffrey,Fiction,1999.0,3.88,379.0,619.0
Winter's Heart,Book Nine of 'The Wheel of Time',Robert Jordan,Fiction,2002.0,3.94,780.0,82029.0
The Sword of Truth,Wizard's First Rule / Stone of Tears / Blood of the Fold,Terry Goodkind,Fiction,1998.0,4.29,2480.0,4110.0
Knife of Dreams,,Robert Jordan,Fiction,2006.0,4.14,860.0,80208.0
The Gate of Fire,,Thomas Harlan,Fiction,2001.0,3.58,721.0,143.0
Ariadne's Web,,Fred Saberhagen,Fiction,2001.0,3.68,432.0,169.0
Mindstar Rising,,Peter F. Hamilton,Fiction,1997.0,3.92,432.0,5979.0
The Simpsons and Philosophy,The D'oh! of Homer,William Irwin;Mark T. Conard;Aeon J. Skoble,Performing Arts,2001.0,3.47,256.0,1983.0
Woody Allen and Philosophy,You Mean My Whole Fallacy is Wrong?,Mark T. Conard;Aeon J. Skoble,Performing Arts,2004.0,3.77,250.0,282.0
Harry Potter and Philosophy,If Aristotle Ran Hogwarts,David Baggett;Shawn Klein;William Irwin,Fiction,2004.0,4.48,243.0,11068.0
Buffy the Vampire Slayer and Philosophy,Fear and Trembling in Sunnydale,James B. South,Performing Arts,2003.0,4.06,335.0,2475.0
The Lord of the Rings and Philosophy,One Book to Rule Them All,Gregory Bassham;Eric Bronson,Literary Criticism,2003.0,4.28,240.0,4828.0
Superheroes and Philosophy,"Truth, Justice, and the Socratic Way",Thomas V. Morris;Matt Morris;William Irwin,Comics & Graphic Novels,2005.0,3.87,300.0,732.0
Star Wars and Philosophy,More Powerful Than You Can Possibly Imagine,Kevin S. Decker;William Irwin;Jason T. Eberl,Performing Arts,2005.0,4.06,227.0,1737.0
The Undead and Philosophy,Chicken Soup for the Soulless,Richard Greene;K. Silem Mohammad,Philosophy,2006.0,3.71,288.0,193.0
The Beatles and Philosophy,Nothing You Can Think that Can't be Thunk,Michael Baur;Steven Baur,Philosophy,2006.0,3.63,288.0,152.0
Bullshit and Philosophy,Guaranteed to Get Perfect Results Every Time,Gary L. Hardcastle;George A. Reisch,Family & Relationships,2006.0,3.59,288.0,67.0
The Little Baby Snoogle-Fleejer,,Jimmy Carter,Friendship,1995.0,3.19,24.0,42.0
Random House Crossword Megaomnibus,,United Feature Syndication,Games,1997.0,0.0,336.0,0.0
Living Faith,,Jimmy Carter,Religion,1998.0,3.79,288.0,456.0
Theodore Rex,,Edmund Morris,Biography & Autobiography,2002.0,4.18,555.0,35943.0
Islam,A Short History,Karen Armstrong,Religion,2002.0,4.02,230.0,7372.0
King Solomon's Mines,,Henry Rider Haggard;James Danly,Fiction,2002.0,3.8,264.0,33836.0
A Working Stiff's Manifesto,"A Memoir of Thirty Jobs I Quit, Nine that Fired Me, and Three I Can't Remember",Iain Levison,Biography & Autobiography,2003.0,3.81,164.0,497.0
Funny in Farsi,A Memoir of Growing Up Iranian in America,Firoozeh Dumas,Biography & Autobiography,2004.0,3.79,240.0,12072.0
The Birth of Venus,A Novel,Sarah Dunant,Fiction,2004.0,3.8,427.0,85882.0
The Knight Of Maison-Rouge,A Novel of Marie Antoinette,Alexandre Dumas,Fiction,2004.0,3.89,448.0,1131.0
A War Like No Other,How the Athenians And Spartans Fought the Peloponnesian War,Victor Davis Hanson,History,2006.0,4.11,397.0,1601.0
Selected Stories of H.G. Wells,,Herbert George Wells,Fiction,2004.0,3.98,432.0,77.0
Reading Lolita in Tehran,A Memoir in Books,Azar Nafisi,Biography & Autobiography,2004.0,3.6,356.0,102707.0
Kim,,Rudyard Kipling,Fiction,2004.0,3.72,306.0,111.0
Color,A Natural History of the Palette,Victoria Finlay,Art,2004.0,3.78,464.0,59145.0
Rendezvous in Black,,Cornell Woolrich,Fiction,2004.0,3.96,211.0,1052.0
No God But God,"The Origins, Evolution, and Future of Islam",Reza Aslan,Religion,2006.0,4.13,310.0,16907.0
The Mysterious Island,,Anonymous,Fiction,2004.0,4.1,723.0,28969.0
The Ox-Bow Incident,,Walter Van Tilburg Clark,Fiction,2004.0,3.82,247.0,4116.0
Mountains Beyond Mountains,,Tracy Kidder,Biography & Autobiography,2004.0,4.22,333.0,59877.0
Caribbean,,James Albert Michener,Fiction,2005.0,3.91,672.0,4527.0
