title,subtitle,authors,categories,published_year,average_rating,num_pages,ratings_count
Gilead,,Marilynne Robinson,Fiction,2004.0,3.85,247.0,361.0
Spider's Web,A Novel,Charles Osborne;Agatha Christie,Detective and mystery stories,2000.0,3.83,241.0,5164.0
The One Tree,,Stephen R. Donaldson,American fiction,1982.0,3.97,479.0,172.0
Rage of angels,,Sidney Sheldon,Fiction,1993.0,3.93,512.0,29532.0
The Four Loves,,Clive Staples Lewis,Christian life,2002.0,4.15,170.0,33684.0
The Problem of Pain,,Clive Staples Lewis,Christian life,2002.0,4.09,176.0,37569.0
An Autobiography,,Agatha Christie,"Authors, English",1977.0,4.27,560.0,3975.0
Empires of the Monsoon,A History of the Indian Ocean and Its Invaders,Richard Hall,"Africa, East",1998.0,4.41,608.0,65.0
The Gap Into Madness,Chaos and Order,Stephen R. Donaldson,"Hyland, Morn (Fictitious character)",1994.0,4.15,743.0,103.0
Master of the Game,,Sidney Sheldon,Adventure stories,1982.0,4.11,489.0,43540.0
If Tomorrow Comes,,Sidney Sheldon,Adventure stories,1994.0,4.04,501.0,49170.0
Assassin's Apprentice,,Robin Hobb,American fiction,1996.0,4.15,460.0,133972.0
Warhost of Vastmark,,Janny Wurts,Fiction,1995.0,4.03,522.0,2966.0
The Once and Future King,,Terence Hanbury White,Arthurian romances,1996.0,4.04,823.0,2805.0
Murder in LaMut,,Raymond E. Feist;Joel Rosenberg,Adventure stories,2003.0,3.7,337.0,5083.0
Jimmy the Hand,,Raymond E. Feist;S. M. Stirling,Fantasy fiction,2003.0,3.95,368.0,5579.0
Well of Darkness,,Margaret Weis;Tracy Hickman,,2001.0,3.66,599.0,68.0
Witness for the Prosecution & Selected Plays,,Agatha Christie,English drama,1995.0,4.05,352.0,3908.0
The Little House,,Philippa Gregory,Country life,1998.0,3.66,368.0,1832.0
Mystical Paths,,Susan Howatch,English fiction,1996.0,4.23,576.0,1023.0
Glittering Images,,Susan Howatch,English fiction,1996.0,4.07,512.0,2045.0
Glamorous Powers,,Susan Howatch,Clergy,1996.0,4.2,512.0,1441.0
The Mad Ship,,Robin Hobb,Fantasy fiction,2000.0,4.24,906.0,36101.0
Post Captain,,Patrick O'Brian,"Aubrey, Jack (Fictitious character)",1996.0,4.29,474.0,7815.0
The Reverse of the Medal,,Patrick O'Brian,Adventure stories,1997.0,4.41,261.0,177.0
Miss Marple,The Complete Short Stories,Agatha Christie,"Detective and mystery stories, English",1997.0,4.2,359.0,6235.0
The Years of Rice and Salt,,Kim Stanley Robinson,Black Death,2003.0,3.73,772.0,194.0
Spares,,Michael Marshall Smith,Human cloning,1998.0,4.13,317.0,2481.0
Gravity,,Tess Gerritsen,Science fiction,2004.0,4.04,342.0,8024.0
The Wise Woman,,Philippa Gregory,Great Britain,2002.0,3.31,640.0,6583.0
Girls' Night in,,Jessica Adams;Chris Manby;Fiona Walker,American fiction,2000.0,3.26,586.0,140.0
The White Album,,Joan Didion,American essays,1993.0,4.17,224.0,91.0
The Bonesetter's Daughter,,Amy Tan,China,2001.0,3.98,352.0,414.0
The Lexus and the Olive Tree,,Thomas L. Friedman,Capitalism,2000.0,3.59,352.0,87.0
'Tis,A Memoir,Frank McCourt,Ireland,2000.0,3.68,495.0,44179.0
Ocean Star Express,,Mark Haddon;Peter Sutton,Juvenile Fiction,2002.0,3.5,32.0,1.0
A Small Pinch of Weather,And Other Stories,Joan Aiken,"Children's stories, English",2000.0,4.27,239.0,116.0
The Princess of the Chalet School,,Elinor Mary Brent-Dyer,Juvenile Fiction,2000.0,4.1,159.0,446.0
Koko,,Peter Straub,Male friendship,2001.0,3.56,634.0,7586.0
Tree and Leaf,The Homecoming of Beorhtnoth : Beorhthelm's Son,John Ronald Reuel Tolkien,Literary Collections,2001.0,4.09,176.0,2245.0
Partners in Crime,,Agatha Christie,"Beresford, Tommy (Fictitious character)",2001.0,3.77,347.0,9506.0
Murder in Mesopotamia,,Agatha Christie,Detective and mystery stories,2001.0,3.89,264.0,25692.0
"The Lord of the Rings, the Return of the King",Visual Companion,Jude Fisher,Imaginary wars and battles,2003.0,4.59,72.0,22.0
All Families are Psychotic,,Douglas Coupland,Dysfunctional families,2002.0,3.69,279.0,350.0
Death in the Clouds,,Agatha Christie,Detective and mystery stories,2001.0,3.8,333.0,21123.0
Appointment with Death,,Agatha Christie,Detective and mystery stories,2001.0,3.86,303.0,24859.0
Hallowe'en Party,,Agatha Christie,"Poirot, Hercule (Fictitious character)",2001.0,3.66,336.0,18820.0
Hercule Poirot's Christmas,,Agatha Christie,Christmas stories,2001.0,3.93,335.0,23113.0
The Big Four,,Agatha Christie,Detective and mystery stories,2002.0,3.59,272.0,22155.0
The Thirteen Problems,,Agatha Christie,"Detective and mystery stories, English",2002.0,3.89,315.0,12840.0
They Do it with Mirrors,,Agatha Christie,American fiction,2002.0,3.75,284.0,415.0
A Murder is Announced,,Agatha Christie,"Detective and mystery stories, English",2002.0,3.98,382.0,680.0
The Mirror Crack'd from Side to Side,,Agatha Christie,"Marple, Jane (Fictitious character)",2002.0,3.91,351.0,23249.0
Mrs McGinty's Dead,,Agatha Christie,Belgians,2002.0,3.83,328.0,525.0
Taken at the Flood,,Agatha Christie,Fiction,2002.0,3.71,352.0,8852.0
The Hollow,,Agatha Christie,Detective and mystery stories,2002.0,3.79,384.0,13022.0
Third Girl,,Agatha Christie,Belgians,2002.0,3.62,365.0,13705.0
The Secret of Chimneys,,Agatha Christie,"Battle, Superintendent (Fictitious character)",2001.0,3.86,400.0,11110.0
The Lord of the Rings,,J. R. R. Tolkien,"Baggins, Frodo (Fictitious character)",2001.0,4.49,1546.0,187.0
The Metaphysical Club,,Louis Menand,Cambridge (Mass.),2002.0,4.07,560.0,3311.0
The illustrated man,,Ray Bradbury,Fiction,2002.0,4.14,186.0,56781.0
Wilkins' Tooth,,Diana Wynne Jones,Business enterprises,2002.0,3.59,207.0,69.0
Cut,,Patricia McCormick,Emotional problems,2002.0,3.76,173.0,107.0
The Lord of the Rings,The Art of The Return of the King,Gary Russell,Characters and characteristics in motion pictures,2004.0,4.54,224.0,28.0
The Lord of the Rings,,John Ronald Reuel Tolkien,"Fantasy fiction, English",2002.0,4.49,1200.0,680.0
The Fellowship of the Ring,,John Ronald Reuel Tolkien;Alan Lee,"Baggins, Frodo (Fictitious character)",2002.0,4.35,410.0,56.0
Lirael,Daughter of the Clayr,Garth Nix,Fantasy fiction,2004.0,4.3,527.0,1339.0
Tales from the Perilous Realm,,John Ronald Reuel Tolkien,"Fairy tales, English",2002.0,4.08,178.0,2964.0
Breaking Open the Head,A Visionary Journey from Cynicism to Shamanism,Daniel Pinchbeck,Hallucinogenic drugs,2004.0,4.06,336.0,46.0
The Yiddish Policemen's Union,A Novel,Michael Chabon,Fiction,2007.0,3.7,414.0,51219.0
"Beware, Princess Elizabeth",,Carolyn Meyer,Children's stories,2003.0,3.88,242.0,78.0
The Family Way,,Tony Parsons,Parenthood,2005.0,3.51,400.0,2095.0
Endless Night,,Agatha Christie,FICTION,2002.0,3.77,303.0,12740.0
How to be Alone,,Jonathan Franzen,Literary Collections,2004.0,3.6,306.0,327.0
The Mysterious Mr. Quin,,Agatha Christie,Detective and mystery stories,2003.0,3.72,396.0,7514.0
The Listerdale Mystery,,Agatha Christie,Detective and mystery stories,2003.0,3.55,317.0,178.0
The Real Trial of Oscar Wilde,,Merlin Holland,Biography & Autobiography,2004.0,4.04,384.0,183.0
I Can Read with Me Eyes Shut!,,Dr. Seuss,"Authors, American",2003.0,4.2,48.0,16561.0
"Oh, the Places You'll Go!",,Dr. Seuss,Adventure stories,2003.0,4.35,48.0,926.0
If I Die in a Combat Zone,,Tim O'Brien,"Vietnam War, 1961-1975",2003.0,3.95,208.0,11.0
The Return of the King,Being the Third Part of The Lord of the Rings,J. R. R. Tolkien,"Baggins, Frodo (Fictitious character)",2003.0,4.52,554.0,253.0
The Silmarillion,,John Ronald Reuel Tolkien;Ted Nasmith,Fiction,2004.0,3.91,386.0,49.0
I Wish that I Had Duck Feet,,Dr. Seuss;Barney Tobey,Children's stories,2004.0,4.16,64.0,8903.0
Oh Say Can You Say?,,Dr. Seuss,Children's stories,2004.0,4.01,36.0,5726.0
There's a Boy in the Girls' Bathroom,,Louis Sachar,Boys,2004.0,3.98,208.0,174.0
Microserfs,,Douglas Coupland,Computer programmers,2004.0,3.88,371.0,436.0
Miss Wyoming,,Douglas Coupland,Actors,2004.0,3.48,320.0,110.0
Where Rainbows End,,Cecelia Ahern,Friendship,2004.0,3.94,454.0,642.0
Poirot,The Complete Ariadne Oliver,Agatha Christie,Authors,2005.0,4.2,727.0,83.0
The Art of The Lord of the Rings,,Gary Russell,Costume,2004.0,4.52,224.0,12.0
The Known World,,Edward P. Jones,African American plantation owners,2004.0,3.83,388.0,437.0
Discover Your Destiny with the Monk Who Sold His Ferrari,The 7 Stages of Self-Awakening,Robin Sharma,Conduct of life,2004.0,3.9,240.0,1956.0
Naked Lunch,The Restored Text,William S. Burroughs,Alienation (Social psychology),2005.0,3.44,289.0,478.0
Tropic of Cancer,,Henry Miller,Fiction,2005.0,3.69,336.0,709.0
Close Range,Brokeback Mountain and Other Stories,Annie Proulx,Cowboys,2006.0,3.99,318.0,466.0
The Love of the Last Tycoon,The Authorized Text,F. Scott Fitzgerald,Fiction,1994.0,3.65,169.0,6836.0
The Song of Rhiannon,The Third Branch of the Mabinogion,Evangeline Walton,Fiction,1992.0,4.02,208.0,247.0
Heart Songs and Other Stories,,Annie Proulx,Fiction,1995.0,3.93,203.0,1822.0
The voyage of the Dawn Treader,,Clive Staples Lewis,Juvenile Fiction,1970.0,4.09,216.0,2869.0
"The Chronicles of Narnia: Lion, the witch and the wardrobe",,Clive Staples Lewis,Fairy tales,1978.0,4.26,1425.0,1446.0
The Short Stories of Ernest Hemingway,,Ernest Hemingway,Fiction,1986.0,4.26,499.0,106.0
"The Screwtape Letters ; With, Screwtape Proposes a Toast",,Clive Staples Lewis,Christianity,1982.0,4.22,172.0,313.0
Reason in History,A General Introduction to the Philosophy of History,Georg Wilhelm Friedrich Hegel,Philosophy,1953.0,3.64,95.0,430.0
The Elements of Style,,William Strunk;Elwyn Brooks White,Language Arts & Disciplines,1979.0,4.2,85.0,204.0
The Presocratics,,Philip Wheelwright,Philosophy,1966.0,4.04,352.0,199.0
Spandau,The Secret Diaries,Albert Speer,History,1976.0,4.12,463.0,6.0
The Rumble Seat Pony,,Clarence William Anderson,"Animals, Treatment of",1971.0,4.17,46.0,24.0
The Journey with Grandmother,,Edith Unnerstad,Grandmothers,1960.0,3.75,197.0,3.0
Tyranny of the Majority,Funamental Fairness in Representative Democracy,Lani Guinier,History,1995.0,3.82,352.0,39.0
The Origins of the Civil Rights Movement,,Aldon D. Morris,History,1986.0,4.04,368.0,145.0
Presidential Power and the Modern Presidents,The Politics of Leadership from Roosevelt to Reagan,Richard E. Neustadt,History,1991.0,3.79,384.0,277.0
"Rest, Rabbit, Rest",,Jacquelyn Reinach;Richard Hefter,Juvenile Fiction,1978.0,4.01,32.0,88.0
Where the Red Fern Grows,The Story of Two Dogs and a Boy : with Connections,Wilson Rawls,Juvenile Fiction,2000.0,4.37,288.0,95.0
Poppy's Return,,Avi,Juvenile Fiction,2006.0,3.99,256.0,1086.0
Diary of a Spider,,Doreen Cronin,Juvenile Fiction,2005.0,4.25,40.0,7903.0
An Old-Fashioned Thanksgiving,,Louisa May Alcott;James Bernardin,Juvenile Fiction,2005.0,3.7,32.0,599.0
The Paradox of Choice,Why More Is Less,Barry Schwartz,Business & Economics,2005.0,3.84,265.0,23734.0
How to Read Literature Like a Professor,a Lively and Entertaining Guide to Reading Between the Lines,Thomas C. Foster,Literary Criticism,2003.0,3.65,314.0,14917.0
The Amazing Maurice and His Educated Rodents,,Terry Pratchett,Juvenile Fiction,2001.0,4.05,256.0,27463.0
The Wee Free Men,,Terry Pratchett,Juvenile Fiction,2004.0,4.27,390.0,72982.0
Going Postal,A Novel of Discworld,Terry Pratchett,Fiction,2004.0,4.38,377.0,924.0
Modern Mind,An Intellectual History of the 20th Century,Peter Watson,Science,2002.0,4.27,847.0,570.0
She Went All the Way,,Meg Cabot,Fiction,2002.0,3.69,357.0,12297.0
Island,,Aldous Huxley,Fiction,1962.0,3.85,354.0,17583.0
A Year in the Life of William Shakespeare,1599,James Shapiro,Biography & Autobiography,2006.0,4.09,333.0,2229.0
Lucy Sullivan Is Getting Married,,Marian Keyes,Fiction,2002.0,3.76,640.0,42096.0
The Terminal Man,,Michael Crichton,Fiction,2002.0,3.36,266.0,20825.0
The Art of the Novel,,Milan Kundera,Literary Criticism,2003.0,3.96,176.0,3544.0
The Bromeliad Trilogy,"Truckers, Diggers, and Wings",Terry Pratchett,Juvenile Fiction,2003.0,4.06,502.0,5681.0
"Merry Christmas, Amelia Bedelia",,Peggy Parish,Juvenile Fiction,2002.0,4.29,64.0,2452.0
Identity,A Novel,Milan Kundera,Fiction,1998.0,3.68,176.0,260.0
The thief of always,a fable,Clive Barker,Fiction,1992.0,4.19,225.0,22123.0
The Illustrated Alchemist,A Fable About Following Your Dream,Paulo Coelho;Alan R. Clarke;Moebius,Fiction,1998.0,3.85,198.0,236.0
Mars and Venus Book of Days,365 Inspriations to Enrich Your Relationships,John Gray,Family & Relationships,1998.0,3.54,368.0,18.0
The Last of the Really Great Whangdoodles,,Julie Andrews Edwards,Juvenile Fiction,1996.0,4.25,209.0,9963.0
Today I Feel Silly & Other Moods That Make My Day,,Jamie Lee Curtis,Juvenile Fiction,1998.0,4.15,40.0,4030.0
The Missing Piece Meets the Big O,,Shel Silverstein,Juvenile Fiction,1981.0,4.33,104.0,10010.0
"Lafcadio, the Lion Who Shot Back",,Shel Silverstein,Juvenile Fiction,1963.0,4.15,112.0,5191.0
The Secret Garden Cookbook,Recipes Inspired by Frances Hodgson Burnett's THE SECRET GARDEN,Amy Cotler,Juvenile Nonfiction,1999.0,4.28,128.0,142.0
Laura's Album,A Remembrance Scrapbook of Laura Ingalls Wilder,William Anderson,Juvenile Nonfiction,1998.0,4.3,80.0,713.0
Quivers,,Robin Quivers,African Americans in radio broadcasting,1995.0,3.51,341.0,60.0
Moonspinners,,Mary Stewart,Fiction,2003.0,4.03,400.0,5868.0
Small Wonder,Essays,Barbara Kingsolver,Literary Collections,2003.0,4.01,264.0,8738.0
Worlds Enough & Time,Five Tales of Speculative Fiction,Dan Simmons,Fiction,2002.0,3.75,272.0,923.0
The Cheese Monkeys,A Novel in Two Semesters,Chip Kidd,Fiction,2002.0,3.75,288.0,4570.0
Travels,,Michael Crichton,Biography & Autobiography,2002.0,3.95,400.0,6812.0
Caesar,A Novel,Colleen McCullough,Fiction,2003.0,4.36,928.0,5825.0
The Forever War,,Joe Haldeman,Fiction,2003.0,4.15,278.0,103375.0
Amelia Bedelia Goes Camping,,Peggy Parish,Juvenile Fiction,2003.0,4.14,64.0,2040.0
The Secret Sister,,Elizabeth Lowell,Fiction,2005.0,3.65,416.0,1164.0
Amelia Bedelia Helps Out,,Peggy Parish,Juvenile Fiction,2005.0,4.25,64.0,7678.0
Whirlpool,,Elizabeth Lowell,Fiction,2006.0,3.78,448.0,1115.0
"Teach Us, Amelia Bedelia",,Peggy Parish,Juvenile Fiction,2004.0,4.21,64.0,3069.0
Cryptonomicon,,Neal Stephenson,Fiction,2002.0,4.25,1139.0,80225.0
Falling Up,Poems and Drawings,Shel Silverstein,Juvenile Nonfiction,2002.0,4.34,178.0,114058.0
Anansi Boys,,Neil Gaiman,Fiction,2006.0,4.02,387.0,153485.0
Fragile Things,Short Fictions and Wonders,Neil Gaiman,Fiction,2006.0,4.01,360.0,43210.0
What Went Wrong?,The Clash Between Islam and Modernity in the Middle East,Bernard Lewis,History,2003.0,3.49,186.0,2409.0
Letters from the Earth,Uncensored Writings,Mark Twain,Literary Criticism,2004.0,4.22,321.0,6447.0
Savannah Blues,A Novel,Mary Kay Andrews,Fiction,2003.0,3.98,404.0,15417.0
The Whipping Boy,,Sid Fleischman,Juvenile Fiction,2003.0,3.56,90.0,19910.0
The Innovator's Dilemma,The Revolutionary Book that Will Change the Way You Do Business,Clayton M. Christensen,Business & Economics,2003.0,3.99,286.0,28568.0
A Nose for Murder,,Lee Charles Kelley,Fiction,2003.0,3.47,267.0,93.0
Happiness,A Novel,Will Ferguson,Fiction,2003.0,3.78,320.0,2191.0
Size 12 Is Not Fat,A Heather Wells Mystery,Meg Cabot,Fiction,2006.0,3.74,345.0,73592.0
Warrior of the Light,A Manual,Paulo Coelho,Fiction,2004.0,3.7,142.0,21578.0
The Devil and Miss Prym,A Novel of Temptation,Paulo Coelho,Fiction,2006.0,3.6,205.0,46113.0
The Big Bing,"Black Holes of Time Management, Gaseous Executive Bodies, Exploding Careers, and Other Theories on the Origins of the Business Universe",Stanley Bing,Business & Economics,2006.0,3.08,368.0,26.0
One Hundred Years of Solitude,,Gabriel Garcia Marquez,Fiction,2003.0,4.06,417.0,547207.0
Walt Whitman,A Life,Justin Kaplan,Biography & Autobiography,2003.0,3.99,464.0,210.0
How to Make Love Like a Porn Star,A Cautionary Tale,Jenna Jameson;Neil Strauss,Biography & Autobiography,2004.0,3.75,592.0,10211.0
The Outsider,,Richard Wright,Fiction,1953.0,4.16,672.0,1736.0
1421,The Year China Discovered America,Gavin Menzies,History,2004.0,3.59,650.0,11289.0
The Andromeda Strain,,Michael Crichton,Fiction,2003.0,3.89,327.0,192637.0
Congo,,Michael Crichton,Fiction,2003.0,3.58,442.0,140223.0
Johnny and the Dead,,Terry Pratchett,Juvenile Fiction,2006.0,3.78,213.0,7733.0
Amelia Bedelia 40th Anniversary Collection,,Peggy Parish,Juvenile Fiction,2003.0,4.41,96.0,256.0
The Girls of Lighthouse Lane #3,Lizabeth's Story,Thomas Kinkade;Erika Tamar,Juvenile Fiction,2005.0,3.96,192.0,24.0
The Bradbury Chronicles,The Life of Ray Bradbury,Sam Weller,Biography & Autobiography,2006.0,4.22,384.0,352.0
Three Rotten Eggs,,Gregory Maguire,Juvenile Fiction,2005.0,3.74,240.0,76.0
The Wicked Day,Book Four of the Arthurian Saga,Mary Stewart,Fiction,2003.0,4.09,417.0,9875.0
The Game,Penetrating the Secret Society of Pickup Artists,Neil Strauss,Biography & Autobiography,2005.0,3.74,464.0,19305.0
"The Lion, the Witch and the Wardrobe (picture book edition)",,C. S. Lewis,Juvenile Fiction,2004.0,4.19,48.0,5012.0
Gold,The Final Science Fiction Collection,Isaac Asimov,Fiction,2003.0,3.99,416.0,2393.0
The Kindness of Strangers,,Katrina Kittle,Fiction,2007.0,4.01,400.0,11432.0
Built to Last,Successful Habits of Visionary Companies,Jim Collins;Jerry I. Porras,Business & Economics,2004.0,3.98,368.0,49529.0
Fluke,"Or, I Know Why the Winged Whale Sings",Christopher Moore,Fiction,2004.0,3.75,321.0,34773.0
Lord of Light,,Roger Zelazny,Fiction,2004.0,4.1,296.0,22530.0
The Perennial Philosophy,,Aldous Huxley,Philosophy,2004.0,4.23,336.0,2959.0
A Crack in the Edge of the World,America and the Great California Earthquake of 1906,Simon Winchester,History,2006.0,3.78,419.0,5242.0
Dead Witch Walking,,Kim Harrison,Fiction,2004.0,4.04,416.0,97105.0
"The Good, the Bad, and the Undead",,Kim Harrison,Fiction,2005.0,4.26,453.0,53112.0
"Men Are from Mars, Women Are from Venus",The Classic Guide to Understanding the Opposite Sex,John Gray,Family & Relationships,2004.0,3.54,368.0,126108.0
Sabriel (adult),,Garth Nix,Fiction,2004.0,4.17,311.0,1296.0
Slouching Toward Nirvana,New Poems,Charles Bukowski,Poetry,2006.0,3.99,288.0,1901.0
Bad Childhood---Good Life,How to Blossom and Thrive in Spite of an Unhappy Childhood,Laura Schlessinger,Self-Help,2006.0,3.92,272.0,502.0
Cat Cross Their Graves,A Joe Grey Mystery,Shirley Rousseau Murphy,Fiction,2005.0,4.3,385.0,481.0
Cat Breaking Free,A Joe Grey Mystery,Shirley Rousseau Murphy,Fiction,2006.0,4.2,375.0,204.0
Slider,A Novel,Patrick Robinson,Sports & Recreation,2004.0,4.18,416.0,64.0
The Black Dahlia Files,"The Mob, the Mogul, and the Murder That Transfixed Los Angeles",Don Wolfe,True Crime,2006.0,3.84,448.0,600.0
Metro Girl,,Janet Evanovich,Fiction,2005.0,3.62,374.0,28414.0
Motor Mouth,,Janet Evanovich,Fiction,2006.0,3.67,312.0,21885.0
Mystic River,,Dennis Lehane,Fiction,2003.0,4.18,416.0,105317.0
Great Short Works of Herman Melville,,Herman Melville,Fiction,2004.0,4.02,512.0,401.0
The Day I Swapped My Dad for Two Goldfish,,Neil Gaiman,Juvenile Fiction,2006.0,4.03,64.0,280.0
Eleven Minutes,A Novel,Paulo Coelho,Fiction,2005.0,3.69,273.0,114826.0
Zen and the Art of Motorcycle Maintenance,An Inquiry Into Values,Robert M. Pirsig,Psychology,2006.0,3.77,540.0,157734.0
Ulysses S. Grant,The Unlikely Hero,Michael Korda,Biography & Autobiography,2004.0,3.88,176.0,410.0
A Dirty Job,A Novel,Christopher Moore,Fiction,2006.0,4.07,387.0,88016.0
Quicksilver,Volume One of the Baroque Cycle,Neal Stephenson,Fiction,2004.0,3.93,927.0,29981.0
Every Book Its Reader,The Power of the Printed Word to Stir the World,Nicholas A. Basbanes,Literary Criticism,2006.0,3.96,400.0,300.0
Flirting With Danger,,Suzanne Enoch,Fiction,2005.0,3.93,384.0,3519.0
Lost Horizon,A Novel,James Hilton,Fiction,2004.0,3.92,241.0,11794.0
The Doors of Perception and Heaven and Hell,,Aldous Huxley,Philosophy,2004.0,3.94,187.0,27716.0
Thanksgiving,,Janet Evanovich,Fiction,2006.0,3.6,228.0,10334.0
Love Overboard,,Janet Evanovich,Fiction,2005.0,3.65,244.0,11223.0
Back to the Bedroom,,Janet Evanovich,Fiction,2005.0,3.67,234.0,9839.0
The Rocky Road to Romance,,Janet Evanovich,Fiction,2004.0,3.67,249.0,9470.0
Thomas Jefferson,Author of America,Christopher Hitchens,Biography & Autobiography,2005.0,3.92,188.0,2181.0
Muhammad,A Prophet for Our Time,Karen Armstrong,Biography & Autobiography,2006.0,4.04,256.0,1662.0
Meeting Jesus Again for the First Time,The Historical Jesus and the Heart of Contemporary Faith,Marcus J. Borg,Religion,1995.0,4.14,160.0,3998.0
Reading the Bible Again for the First Time,Taking the Bible Seriously but Not Literally,Marcus J. Borg,Religion,2002.0,4.13,321.0,2875.0
Shadow of the Almighty,The Life and Testament of Jim Elliot,Elisabeth Elliot,Religion,1989.0,4.39,272.0,6658.0
The Dance of the Dissident Daughter,,Sue Monk Kidd,Religion,2002.0,3.96,256.0,5319.0
C.S. Lewis,Readings for Meditation and Reflection,C. S. Lewis,Religion,1996.0,4.31,176.0,255.0
The Screwtape Letters,,C. S. Lewis,Religion,2001.0,4.22,224.0,116735.0
Mere Christianity,,C. S. Lewis,Religion,2001.0,4.32,227.0,7316.0
Learning to Love,Exploring Solitude and Freedom,Thomas Merton,Religion,1998.0,4.5,382.0,15.0
The Mediator #4: Darkest Hour,,Meg Cabot,Juvenile Fiction,2004.0,4.17,316.0,30018.0
Cash,The Autobiography,Johnny Cash,Biography & Autobiography,2003.0,4.07,310.0,16485.0
"The Collected Letters of C.S. Lewis, Volume 1","Family Letters, 1905-1931",C. S. Lewis,Biography & Autobiography,2004.0,4.37,1072.0,112.0
Touching the Void,The True Story of One Man's Miraculous Survival,Joe Simpson,Sports & Recreation,2004.0,4.21,218.0,42264.0
Anybody Out There?,A Novel,Marian Keyes,Fiction,2006.0,3.91,456.0,343.0
My Little Pony: Hide-and-Seek,,Jennifer Frantz,Juvenile Fiction,2004.0,4.14,24.0,37.0
The Confusion,Volume Two of The Baroque Cycle,Neal Stephenson,Fiction,2005.0,4.25,815.0,18790.0
Bridge to Terabithia (rack),,Katherine Paterson,Juvenile Fiction,2004.0,3.99,191.0,1764.0
Practical Demonkeeping,,Christopher Moore,Fiction,2004.0,3.82,256.0,36255.0
Island of the Sequined Love Nun,,Christopher Moore,Fiction,2004.0,3.79,336.0,26949.0
The Lust Lizard of Melancholy Cove,,Christopher Moore,Fiction,2004.0,3.86,304.0,28420.0
Weetzie Bat,,Francesca Lia Block,Juvenile Fiction,2004.0,3.74,128.0,12771.0
Behind the Curtain,An Echo Falls Mystery,Peter Abrahams,Juvenile Fiction,2006.0,3.9,352.0,30.0
"Catherine, Called Birdy (Summer Reading Edition)",,Karen Cushman,Juvenile Fiction,2004.0,3.71,224.0,33009.0
Wicked Musical Tie-in Edition,The Life and Times of the Wicked Witch of the West,Gregory Maguire,Fiction,2004.0,3.53,409.0,2747.0
Son of a Witch,A Novel,Gregory Maguire,Fiction,2006.0,3.47,352.0,51493.0
This Rough Magic,,Mary Stewart,Fiction,2004.0,4.05,373.0,4966.0
Airs Above the Ground,,Mary Stewart,Fiction,2004.0,4.04,384.0,4458.0
The Mediator #5: Haunted,,Meg Cabot,Juvenile Fiction,2004.0,4.15,263.0,31501.0
Beauty,A Retelling of the Story of Beauty and the Beast,Robin McKinley,Juvenile Fiction,2005.0,4.05,325.0,3203.0
Mating in Captivity,Reconciling the Erotic and the Domestic,Esther Perel,Psychology,2006.0,4.13,272.0,7699.0
Forgotten New York,Views of a Lost Metropolis,Kevin Walsh,Travel,2006.0,4.18,384.0,198.0
The Dead Beat,"Lost Souls, Lucky Stiffs, and the Perverse Pleasures of Obituaries",Marilyn Johnson,Social Science,2007.0,3.41,272.0,1106.0
Charms for the Easy Life,,Kaye Gibbons,Fiction,2005.0,4.02,272.0,10983.0
The Reading Group,A Novel,Elizabeth Noble,Fiction,2005.0,3.34,429.0,6408.0
A Couple of April Fools,,Gregory Maguire,Juvenile Fiction,2005.0,3.5,240.0,3.0
What Christians Believe,,C. S. Lewis,Religion,2005.0,4.2,98.0,517.0
Psyche in a Dress,,Francesca Lia Block,Juvenile Fiction,2006.0,3.84,116.0,2414.0
YOU: The Owner's Manual,An Insider's Guide to the Body that Will Make You Healthier and Younger,Michael F Roizen;Mehmet C Oz,Health & Fitness,2005.0,3.82,417.0,3099.0
The Chronicles of Narnia Movie Tie-in Edition (adult),,C. S. Lewis,Fiction,2005.0,4.26,766.0,1099.0
"The Lion, the Witch and the Wardrobe Movie Tie-in Edition (rack)",,C. S. Lewis,Juvenile Fiction,2005.0,4.21,189.0,615.0
"The Nightmare Room, Books 1-2-3: The Nightmare Begins!",,R.L. Stine,Juvenile Fiction,2005.0,3.89,432.0,92.0
A Quick Bite,,Lynsay Sands,Fiction,2005.0,3.91,360.0,34478.0
Goodnight Moon 60th Anniversary Edition,,Margaret Wise Brown,Juvenile Fiction,2005.0,4.27,32.0,264013.0
Brave New World and Brave New World Revisited,,Aldous Huxley,Fiction,2005.0,4.16,340.0,123044.0
The Final Solution,A Story of Detection,Michael Chabon,Fiction,2005.0,3.31,131.0,13455.0
The Cat's Pajamas,Stories,Ray Bradbury,Fiction,2005.0,3.73,234.0,1316.0
Holy Skirts,A Novel of a Flamboyant Woman Who Risked All for Art,Rene Steinke,Fiction,2005.0,3.61,384.0,322.0
Time For Kids: Butterflies!,,Editors of TIME For Kids,Juvenile Nonfiction,2006.0,4.0,32.0,20.0
A False Mirror,An Inspector Ian Rutledge Mystery,Charles Todd,Fiction,2007.0,4.02,384.0,2354.0
Cracks in My Foundation,"Bags, Trips, Make-up Tips, Charity, Glory, and the Darker Side of the Story: Essays and Stories by Marian Keyes",Marian Keyes,Fiction,2005.0,3.81,368.0,1569.0
A Fistful of Charms,,Kim Harrison,Fiction,2006.0,4.28,510.0,46881.0
For a Few Demons More,,Kim Harrison,Fiction,2007.0,4.33,456.0,47314.0
Mysteries of Pittsburgh,A Novel,Michael Chabon,Fiction,2005.0,3.64,320.0,21338.0
Everything Is Illuminated tie-in,A Novel,Jonathan Safran Foer,Fiction,2005.0,3.9,276.0,1754.0
Flight of the Nighthawks,Book One of the Darkwar Saga,Raymond E. Feist,Fiction,2006.0,3.95,368.0,9378.0
Into a Dark Realm,Book Two of the Darkwar Saga,Raymond E. Feist,Fiction,2007.0,4.0,319.0,8974.0
The 3-Hour Diet (TM) On the Go (Collins Gem),,Jorge Cruise,Health & Fitness,2005.0,3.08,192.0,30.0
The Best American Crime Writing 2006,,Mark Bowden;Otto Penzler;Thomas H. Cook,True Crime,2006.0,3.99,352.0,200.0
Last of the Wilds,Age of the Five Trilogy,Trudi Canavan,Fiction,2006.0,4.03,576.0,9725.0
Voice of the Gods,Age of the Five Trilogy,Trudi Canavan,Fiction,2007.0,4.08,592.0,9413.0
Missing Mom,A Novel,Joyce Carol Oates,Fiction,2006.0,3.54,464.0,3425.0
"The Collected Letters of C.S. Lewis, Volume 3","Narnia, Cambridge, and Joy, 1950 - 1963",C. S. Lewis,Biography & Autobiography,2004.0,4.49,1840.0,140.0
Touch Not the Cat,,Mary Stewart,Fiction,2005.0,3.91,372.0,4857.0
